{
  "id": "cillian-murphy-long-layered",
  "hairstyleIds": [
    "hairstyle-long-layered-cut"
  ],
  "imageId": "cillian-long-layered-example",
  "title": "Medium-long side-parted layers",
  "caption": "Fictional adult model showing medium-long layers with a loose side part and a sweeping fringe.",
  "patternDescription": "Slight wave is illustrative and does not claim a natural subtype.",
  "lengthDescription": "Length reaches the nape and collar, with visible layered movement through the sides and back."
}
