{
  "id": "style-example-wolf-cut-curly-medium",
  "hairstyleIds": [
    "hairstyle-wolf-cut"
  ],
  "imageId": "wolf-cut-curly-medium",
  "title": "Medium curly wolf cut",
  "caption": "Notice the concentrated crown volume, shorter face-framing curls, and longer layers retained toward the nape.",
  "patternDescription": "Defined curls make the layered silhouette fuller and rounder while the shorter crown remains distinct from the longer back.",
  "lengthDescription": "The longest curls reach around the shoulders, with substantially shorter layers through the crown and around the face."
}
