{
  "id": "rihanna-bob-example",
  "hairstyleIds": [
    "hairstyle-blunt-bob"
  ],
  "imageId": "rihanna-bob-example",
  "title": "Short rounded bob with deep side fringe",
  "caption": "Fictional adult model illustrating a compact asymmetrical bob shape with a long side-swept fringe; hair color is illustrative and not a claim about the observed appearance.",
  "patternDescription": "The generated model's natural hair pattern is not specified; the hair is shown smooth and styled.",
  "lengthDescription": "Short rounded bob shape with longer top and side fringe and a short tapered nape."
}
