{
  "id": "side-parted-flipped-lob-afro-latina-example",
  "hairstyleIds": [
    "hairstyle-side-parted-flipped-lob"
  ],
  "imageId": "side-parted-flipped-lob-afrolatina-55",
  "title": "Mature side-parted flipped lob",
  "caption": "A fictional Afro-Latina woman in her mid-50s wears a polished shoulder-grazing lob with a pronounced side part and controlled flipped ends.",
  "patternDescription": "Smooth blowout with restrained volume at the crown and outward-curved tips.",
  "lengthDescription": "Shoulder-grazing lob with a compact, softly rounded outline."
}
