{
  "id": "farrah-fawcett-cut-classic-feathered",
  "hairstyleIds": [
    "hairstyle-farrah-fawcett-cut"
  ],
  "imageId": "farrah-fawcett-cut-classic-feathered",
  "title": "Classic feathered Farrah cut",
  "caption": "A fictional blonde woman wearing long, highly layered hair with broad face-opening feathers, elevated side volume and outward-flipped lower sections.",
  "patternDescription": "Presented with a Type 1C-to-2A-like blow-dried finish that supplies enough body for the large feathered sections; the image does not establish the fictional model's natural hair subtype.",
  "lengthDescription": "Long, extending below the shoulders, with progressively shorter layers around the face and upper sides."
}
