{
  "id": "style-example-wolf-cut-wavy-medium",
  "hairstyleIds": [
    "hairstyle-wolf-cut"
  ],
  "imageId": "wolf-cut-wavy-medium",
  "title": "Medium wavy wolf cut",
  "caption": "Shorter crown and face-framing layers create volume above visibly longer, lighter ends.",
  "patternDescription": "The silhouette expands around the crown and cheek area before narrowing into longer separated layers toward the shoulders.",
  "lengthDescription": "Longest layers finish around the shoulders while substantially shorter layers sit through the crown and front."
}
