{
  "id": "style-example-thin-mohawk-dark",
  "hairstyleIds": [
    "hairstyle-thin-mohawk"
  ],
  "imageId": "thin-mohawk-dark",
  "title": "Dark narrow mohawk",
  "caption": "Notice how the dark center strip keeps the silhouette focused against close sides.",
  "patternDescription": "A narrow upright strip provides the only concentrated height through the top.",
  "lengthDescription": "The sides are kept close while the center retains short styling length."
}
