{
  "id": "style-example-blunt-bob-chin",
  "hairstyleIds": [
    "hairstyle-blunt-bob"
  ],
  "imageId": "blunt-bob-chin",
  "title": "Chin-length blunt bob",
  "caption": "Notice the strong jaw-length perimeter and the absence of visible layering.",
  "patternDescription": "The hair falls into one compact outer line, with the front and side lengths reading as part of the same blunt shape.",
  "lengthDescription": "The perimeter finishes at approximately chin level; confirm the exact dry length and whether any subtle internal shaping is wanted."
}
