{
  "id": "timothee-short-curly-shag-example",
  "hairstyleIds": [
    "hairstyle-short-curly-shag"
  ],
  "imageId": "timothee-short-curly-shag-example",
  "title": "Short curly shag with airy fringe",
  "caption": "Fictional adult model illustrating a short layered shag with loose curls, crown volume, and a softly broken fringe.",
  "patternDescription": "Loose curl definition with irregular front curls; the fictional model's natural hair subtype is not asserted.",
  "lengthDescription": "Short-to-medium curls across the crown and sides; the example illustrates the shag silhouette rather than an exact copy of the 2018 appearance."
}
