{
  "id": "lady-gaga-top-knot-example",
  "hairstyleIds": [
    "hairstyle-top-knot"
  ],
  "imageId": "lady-gaga-top-knot-example",
  "title": "High top knot",
  "caption": "Fictional adult model wearing dark hair gathered into a neat high top knot with smooth sides.",
  "patternDescription": "The image is a styling illustration; it does not identify the model's natural hair type.",
  "lengthDescription": "Hair is long enough to gather and coil securely at the crown; the image does not establish its cut or exact length."
}
