{
  "id": "style-example-flat-top-coily",
  "hairstyleIds": [
    "hairstyle-flat-top"
  ],
  "imageId": "flat-top-coily",
  "title": "Low flat top with graduated sides",
  "caption": "Notice the low horizontal plane and the compact transition into the shorter sides.",
  "patternDescription": "The top reads as a restrained flat surface while the visible texture softens the edges of the silhouette.",
  "lengthDescription": "A low, close shape with short graduated sides; confirm the height and finish with the barber."
}
