{
  "id": "farrah-fawcett-cut-black",
  "hairstyleIds": [
    "hairstyle-farrah-fawcett-cut"
  ],
  "imageId": "farrah-fawcett-cut-black",
  "title": "Black-haired feathered Farrah cut",
  "caption": "A fictional Indian woman in her 20s wearing long black hair in a Farrah-style feathered cut with broad face-opening layers and outward-flipped lower sections.",
  "patternDescription": "Presented with a Type 1C-to-2A-like blow-dried finish that gives the black hair enough body for the large feathered sections; the image does not establish the fictional model's natural hair subtype.",
  "lengthDescription": "Long, extending below the shoulders, with shorter graduated face-framing layers beginning around the cheekbones and progressively longer feathered sections through the sides and lower lengths."
}
