{
  "id": "style-example-top-knot-tapered",
  "hairstyleIds": [
    "hairstyle-top-knot"
  ],
  "imageId": "top-knot-tapered",
  "title": "Top knot with tapered perimeter",
  "caption": "Notice the gathered crown above the close, gradually shortened sides.",
  "patternDescription": "The knot concentrates length at the crown while the perimeter creates a clean contrast.",
  "lengthDescription": "Enough crown length is gathered securely; the perimeter is shorter and tapered around the ears and nape."
}
