{
  "id": "finger-waves-deep-side-part-example",
  "hairstyleIds": [
    "hairstyle-finger-waves"
  ],
  "imageId": "finger-waves-deep-side-part",
  "title": "Close-cropped finger waves with deep side part",
  "caption": "A fictional Black adult wearing glossy close-cropped finger waves with a deep side part and continuous sculpted ridges visible from the forehead through the temple and side of the head.",
  "patternDescription": "The finished set shows compact, connected S-shaped ridges molded close to the scalp; the image does not establish the fictional model’s natural hair subtype.",
  "lengthDescription": "Very short to short hair kept close enough to the scalp for the ridge pattern to remain continuous and clearly legible."
}
