{
  "id": "sleek-long-cut-silver-gray",
  "hairstyleIds": [
    "hairstyle-sleek-long-cut"
  ],
  "imageId": "sleek-long-cut-silver-gray",
  "title": "Sleek long cut on silver-gray hair",
  "caption": "A fictional white woman in her 60s wearing long silver-gray hair in a smooth, center-parted, near-one-length cut.",
  "patternDescription": "Type 1A straight appearance: smooth straight silver-gray lengths with minimal visible wave and a continuous surface.",
  "lengthDescription": "Long, falling below the shoulders with a dense softly blunted perimeter."
}
