{
  "id": "the-rachel-soft-wave",
  "hairstyleIds": [
    "hairstyle-the-rachel"
  ],
  "imageId": "the-rachel-soft-wave",
  "title": "Rachel cut with softer wave",
  "caption": "A fictional Black or mixed-race woman in her 50s wearing a softer Rachel interpretation with shoulder-length layering, visible face framing and restrained 1990s volume.",
  "patternDescription": "Presented with a Type 2A-like softly waved blowout: loose bends remain visible while the round-brush styling still separates the layered silhouette; the image does not establish the model’s natural hair subtype.",
  "lengthDescription": "Medium length around the shoulders, with shorter curved sections through the face and upper sides and flicked ends at the lower perimeter."
}
