{
  "id": "style-example-patterned-mohawk-geometric",
  "hairstyleIds": [
    "hairstyle-patterned-mohawk"
  ],
  "imageId": "patterned-mohawk-geometric",
  "title": "Geometric patterned crest",
  "caption": "Notice the crisp geometric side detail and the narrower upright center.",
  "patternDescription": "Hard side lines make the central crest read more graphic and deliberate.",
  "lengthDescription": "Close sides contrast with a short upright center; the shaved detail will need regular refreshing."
}
