{
  "id": "style-example-patterned-mohawk-curved",
  "hairstyleIds": [
    "hairstyle-patterned-mohawk"
  ],
  "imageId": "patterned-mohawk-curved",
  "title": "Curved patterned crest",
  "caption": "Notice the raised center and the curved side design working as one silhouette.",
  "patternDescription": "The central strip stays visibly higher while the shaved pattern frames its rounded edge.",
  "lengthDescription": "The crest keeps enough length to stand above close patterned sides; exact height is a consultation choice."
}
